{"calibration_state":"bootstrap","estimator_method_version":"empirical-v3","excluded_observation_count_floor":1940,"exclusion_count_rounding":"floor_to_public_k","generated_date":"2026-10-19","limitations":["actual_marginal_cash_unavailable","bootstrap_descriptive_only","greenfield_prior_unavailable","informational_backtest_below_policy","quota_delay_prior_unavailable","rework_review_prior_unavailable","token_prior_unavailable","wait_class_prior_unavailable"],"nodes":[{"aggregate_sha256":"78ba3eca7841a00bb57256c604af96006c589d25213cde20869ef13a0edcfb61","calibration_quality":{"holdout_count":151,"p80_coverage_basis_points":5761,"p95_coverage_basis_points":8741},"drift_indicators":{"duration_drift_basis_points":7280,"token_drift_basis_points":0},"effective_sample_size":525,"estimator_method_version":"empirical-v3","fallback_parent":"project_type.enhancement","generated_date":"2026-10-19","hierarchy_node":"h2.f9c0dc358bece64b.cb-merged","metric_support":{"actual_marginal_cash":{"eligible_count":0,"status":"unavailable"},"focused_duration":{"eligible_count":600,"status":"published"},"quota_delay":{"eligible_count":0,"status":"unavailable"},"rework_review":{"eligible_count":0,"status":"unavailable"},"token_usage":{"eligible_count":0,"status":"unavailable"},"wait_class":{"eligible_count":0,"status":"unavailable"}},"phase_duration_quantiles":[{"p50":956,"p80":2130,"p95":5397,"phase":"overall"}],"release_manifest_sha256":"790e7b6af43c03aef9399dea81b13f95c67cc10efb27700b680b26c937c035d5","sample_count":600,"schema_version":1,"source_cutoff_date":"2026-10-19","source_eras":["unknown"],"uncertainty_floors":{"duration_basis_points":0,"token_basis_points":0}},{"aggregate_sha256":"78ba3eca7841a00bb57256c604af96006c589d25213cde20869ef13a0edcfb61","calibration_quality":{"holdout_count":151,"p80_coverage_basis_points":5761,"p95_coverage_basis_points":8741},"drift_indicators":{"duration_drift_basis_points":7280,"token_drift_basis_points":0},"effective_sample_size":525,"estimator_method_version":"empirical-v3","fallback_parent":"h2.f9c0dc358bece64b.cb-merged","generated_date":"2026-10-19","hierarchy_node":"h3.ee07c00dc4194839.rc-workspace","metric_support":{"actual_marginal_cash":{"eligible_count":0,"status":"unavailable"},"focused_duration":{"eligible_count":600,"status":"published"},"quota_delay":{"eligible_count":0,"status":"unavailable"},"rework_review":{"eligible_count":0,"status":"unavailable"},"token_usage":{"eligible_count":0,"status":"unavailable"},"wait_class":{"eligible_count":0,"status":"unavailable"}},"phase_duration_quantiles":[{"p50":956,"p80":2130,"p95":5397,"phase":"overall"}],"release_manifest_sha256":"790e7b6af43c03aef9399dea81b13f95c67cc10efb27700b680b26c937c035d5","sample_count":600,"schema_version":1,"source_cutoff_date":"2026-10-19","source_eras":["unknown"],"uncertainty_floors":{"duration_basis_points":0,"token_basis_points":0}},{"aggregate_sha256":"78ba3eca7841a00bb57256c604af96006c589d25213cde20869ef13a0edcfb61","calibration_quality":{"holdout_count":151,"p80_coverage_basis_points":5761,"p95_coverage_basis_points":8741},"drift_indicators":{"duration_drift_basis_points":7280,"token_drift_basis_points":0},"effective_sample_size":525,"estimator_method_version":"empirical-v3","fallback_parent":"h3.ee07c00dc4194839.rc-workspace","generated_date":"2026-10-19","hierarchy_node":"h4.02f3f5734dfa4389.pm-unknown","metric_support":{"actual_marginal_cash":{"eligible_count":0,"status":"unavailable"},"focused_duration":{"eligible_count":600,"status":"published"},"quota_delay":{"eligible_count":0,"status":"unavailable"},"rework_review":{"eligible_count":0,"status":"unavailable"},"token_usage":{"eligible_count":0,"status":"unavailable"},"wait_class":{"eligible_count":0,"status":"unavailable"}},"phase_duration_quantiles":[{"p50":956,"p80":2130,"p95":5397,"phase":"overall"}],"release_manifest_sha256":"790e7b6af43c03aef9399dea81b13f95c67cc10efb27700b680b26c937c035d5","sample_count":600,"schema_version":1,"source_cutoff_date":"2026-10-19","source_eras":["unknown"],"uncertainty_floors":{"duration_basis_points":0,"token_basis_points":0}},{"aggregate_sha256":"78ba3eca7841a00bb57256c604af96006c589d25213cde20869ef13a0edcfb61","calibration_quality":{"holdout_count":151,"p80_coverage_basis_points":5761,"p95_coverage_basis_points":8741},"drift_indicators":{"duration_drift_basis_points":7280,"token_drift_basis_points":0},"effective_sample_size":525,"estimator_method_version":"empirical-v3","fallback_parent":"h4.02f3f5734dfa4389.pm-unknown","generated_date":"2026-10-19","hierarchy_node":"h5.0271ef33616a9922.si-s0-i0","metric_support":{"actual_marginal_cash":{"eligible_count":0,"status":"unavailable"},"focused_duration":{"eligible_count":600,"status":"published"},"quota_delay":{"eligible_count":0,"status":"unavailable"},"rework_review":{"eligible_count":0,"status":"unavailable"},"token_usage":{"eligible_count":0,"status":"unavailable"},"wait_class":{"eligible_count":0,"status":"unavailable"}},"phase_duration_quantiles":[{"p50":956,"p80":2130,"p95":5397,"phase":"overall"}],"release_manifest_sha256":"790e7b6af43c03aef9399dea81b13f95c67cc10efb27700b680b26c937c035d5","sample_count":600,"schema_version":1,"source_cutoff_date":"2026-10-19","source_eras":["unknown"],"uncertainty_floors":{"duration_basis_points":0,"token_basis_points":0}},{"aggregate_sha256":"78ba3eca7841a00bb57256c604af96006c589d25213cde20869ef13a0edcfb61","calibration_quality":{"holdout_count":151,"p80_coverage_basis_points":5761,"p95_coverage_basis_points":8741},"drift_indicators":{"duration_drift_basis_points":7280,"token_drift_basis_points":0},"effective_sample_size":525,"estimator_method_version":"empirical-v3","fallback_parent":"h5.0271ef33616a9922.si-s0-i0","generated_date":"2026-10-19","hierarchy_node":"h6.491830f3876dd460.risk-unknown","metric_support":{"actual_marginal_cash":{"eligible_count":0,"status":"unavailable"},"focused_duration":{"eligible_count":600,"status":"published"},"quota_delay":{"eligible_count":0,"status":"unavailable"},"rework_review":{"eligible_count":0,"status":"unavailable"},"token_usage":{"eligible_count":0,"status":"unavailable"},"wait_class":{"eligible_count":0,"status":"unavailable"}},"phase_duration_quantiles":[{"p50":956,"p80":2130,"p95":5397,"phase":"overall"}],"release_manifest_sha256":"790e7b6af43c03aef9399dea81b13f95c67cc10efb27700b680b26c937c035d5","sample_count":600,"schema_version":1,"source_cutoff_date":"2026-10-19","source_eras":["unknown"],"uncertainty_floors":{"duration_basis_points":0,"token_basis_points":0}},{"aggregate_sha256":"78ba3eca7841a00bb57256c604af96006c589d25213cde20869ef13a0edcfb61","calibration_quality":{"holdout_count":151,"p80_coverage_basis_points":5761,"p95_coverage_basis_points":8741},"drift_indicators":{"duration_drift_basis_points":7280,"token_drift_basis_points":0},"effective_sample_size":525,"estimator_method_version":"empirical-v3","fallback_parent":"h6.491830f3876dd460.risk-unknown","generated_date":"2026-10-19","hierarchy_node":"h7.90c2ff5c98a8249b.burden-ordinary","metric_support":{"actual_marginal_cash":{"eligible_count":0,"status":"unavailable"},"focused_duration":{"eligible_count":600,"status":"published"},"quota_delay":{"eligible_count":0,"status":"unavailable"},"rework_review":{"eligible_count":0,"status":"unavailable"},"token_usage":{"eligible_count":0,"status":"unavailable"},"wait_class":{"eligible_count":0,"status":"unavailable"}},"phase_duration_quantiles":[{"p50":956,"p80":2130,"p95":5397,"phase":"overall"}],"release_manifest_sha256":"790e7b6af43c03aef9399dea81b13f95c67cc10efb27700b680b26c937c035d5","sample_count":600,"schema_version":1,"source_cutoff_date":"2026-10-19","source_eras":["unknown"],"uncertainty_floors":{"duration_basis_points":0,"token_basis_points":0}},{"aggregate_sha256":"78ba3eca7841a00bb57256c604af96006c589d25213cde20869ef13a0edcfb61","calibration_quality":{"holdout_count":151,"p80_coverage_basis_points":5761,"p95_coverage_basis_points":8741},"drift_indicators":{"duration_drift_basis_points":7280,"token_drift_basis_points":0},"effective_sample_size":525,"estimator_method_version":"empirical-v3","fallback_parent":"h7.90c2ff5c98a8249b.burden-ordinary","generated_date":"2026-10-19","hierarchy_node":"h8.f0143afc84120883.ep-e0-unknown","metric_support":{"actual_marginal_cash":{"eligible_count":0,"status":"unavailable"},"focused_duration":{"eligible_count":600,"status":"published"},"quota_delay":{"eligible_count":0,"status":"unavailable"},"rework_review":{"eligible_count":0,"status":"unavailable"},"token_usage":{"eligible_count":0,"status":"unavailable"},"wait_class":{"eligible_count":0,"status":"unavailable"}},"phase_duration_quantiles":[{"p50":956,"p80":2130,"p95":5397,"phase":"overall"}],"release_manifest_sha256":"790e7b6af43c03aef9399dea81b13f95c67cc10efb27700b680b26c937c035d5","sample_count":600,"schema_version":1,"source_cutoff_date":"2026-10-19","source_eras":["unknown"],"uncertainty_floors":{"duration_basis_points":0,"token_basis_points":0}},{"aggregate_sha256":"78ba3eca7841a00bb57256c604af96006c589d25213cde20869ef13a0edcfb61","calibration_quality":{"holdout_count":151,"p80_coverage_basis_points":5761,"p95_coverage_basis_points":8741},"drift_indicators":{"duration_drift_basis_points":7280,"token_drift_basis_points":0},"effective_sample_size":525,"estimator_method_version":"empirical-v3","fallback_parent":"h8.f0143afc84120883.ep-e0-unknown","generated_date":"2026-10-19","hierarchy_node":"h9.f4963e420b65c022.orch-single","metric_support":{"actual_marginal_cash":{"eligible_count":0,"status":"unavailable"},"focused_duration":{"eligible_count":600,"status":"published"},"quota_delay":{"eligible_count":0,"status":"unavailable"},"rework_review":{"eligible_count":0,"status":"unavailable"},"token_usage":{"eligible_count":0,"status":"unavailable"},"wait_class":{"eligible_count":0,"status":"unavailable"}},"phase_duration_quantiles":[{"p50":956,"p80":2130,"p95":5397,"phase":"overall"}],"release_manifest_sha256":"790e7b6af43c03aef9399dea81b13f95c67cc10efb27700b680b26c937c035d5","samp